{
  "schema_version": 2,
  "project": "SubLift",
  "phase": "Phase 18 - Det 输入几何契约与默认切换",
  "goal": "在不牺牲字幕质量的前提下，把 det 输入几何从固定的 RapidOCR min-side 736 切换为可配置的 0.6MP 面积下限策略，并把该维度的验收从逐字节 parity 迁移到质量门。完成后，默认路径在固定 1080p bottom-crop 负载上获得约 3 倍端到端加速，文本 CER/exact 不劣于现状，质量门、覆盖矩阵与一键回滚均可复核。",
  "scope": [
    "D01：批准 ADR-0042，冻结 det 几何策略（0.6MP 面积下限；短边 320/352 仅作条件项）与质量门阈值；把 SUBLIFT_DET_PIXEL_BUDGET 诊断开关收敛为可校验配置；本阶段不改变产品默认输出。",
    "D02：用 python-product-last 历史 Oracle 重放 736 基线；把 check_paddle_gate.py 的 det 维度从逐字节相等改为质量阈值；重冻 paddle 质量基线并保留旧基线归档。",
    "D03：建立 bottom-crop / full-frame / ROI / 竖屏 / 超宽 / 真实低分辨率的覆盖矩阵；跑 paddle_quality 全门；实现相邻碎片合并并复核 0.6 与左边界裁切。",
    "D04：切换默认几何，完成固定负载 A/B 与回滚演练，同步 progress.md 与 phases.json，按流程推进 ready-for-merge 与 done。"
  ],
  "non_goals": [
    "不修改 det/rec 模型、ORT 二进制、intra_op 线程数、Rec batch 等 ADR-0025/0028 已冻结值。",
    "不在本 Phase 实施 det-once + rec-many、GPU/CUDA、并发调度或 ffmpeg 调优；这些另立 Phase。",
    "不重新引入 Python 产品 runtime、Python IPC 或 .venv 驱动的 Worker 查找。",
    "不改变 SRT 文本格式、时间码、编码，以及非 det 维度的配置/状态/错误语义。",
    "不以性能名义跳过质量门、覆盖矩阵或回滚演练，也不伪造跨机 hash 验证。"
  ],
  "status": "in-progress",
  "deliverables": [
    {
      "id": "D01",
      "name": "Det 几何契约 ADR 与配置面",
      "outcome": "ADR-0042 获批并记录；det 几何策略（0.6MP 面积下限）与质量门阈值冻结；诊断 env 收敛为可校验配置；产品默认仍为 736，本 Deliverable 不改变输出。",
      "acceptance": [
        "ADR-0042 写入 docs/DECISIONS.md，明确退出 parity 的维度（det 几何）与保留 parity 的维度（SRT 格式/时间码/编码、非 det 语义、模型与 ORT 指纹）。",
        "几何策略采用 0.6MP 面积下限：面积不足 0.6MP 才放大，原生面积已 ≥0.6MP 时不缩放，只放大不缩小，32 对齐；短边 320/352 仅作条件项，不进入默认；40%+/full-frame 不参与默认决策。",
        "配置项可从 CLI/config 读取并覆盖；非法或非正值 fail-closed 或回退默认，不再依赖未校验的 env；SUBLIFT_DET_PIXEL_BUDGET 降级为诊断别名或移除。",
        "默认值保持 736；现有 CTest 与默认路径 SRT sha256（56b1b08a…）不变。"
      ],
      "areas": [
        "cpp/src/adapters/paddle",
        "cpp/include",
        "cpp/tests",
        "docs/DECISIONS.md",
        "docs/design"
      ],
      "status": "in-progress",
      "evidence": [
        "2026-10-22：ADR-0042 获批并写入 docs/DECISIONS.md；Phase 17 的 Session/Layout/工具链收口拆出为 Phase 19，Phase 17 以 D01–D02 收口 done，Phase 18 置 in-progress。D01 配置面进行中。"
      ]
    },
    {
      "id": "D02",
      "name": "质量门重放与基线重冻",
      "outcome": "历史 Python Oracle 可在合并层不介入的素材上重放 736；paddle 质量门把 det 几何与字幕合并层改为可解释的质量阈值；新基线可复现并被 gate 消费。",
      "acceptance": [
        "用 python-product-last 历史 worktree 在合并层不介入的素材上重放 736，归一化文本与 C++ 736 一致；记录命令、依赖版本、模型指纹与偏离原因。",
        "记录并解释冻结 Oracle 基线（544426e）与 C++ 合并层（2fe2f91）的既有偏离；确认该偏离属于有意质量变更，并纳入新基线或分层定义。",
        "check_paddle_gate.py 对 det 几何与合并层分别定义质量门（CER/exact/usable/timing F1/precision/noise/empty）；不再要求受这两层影响的整段 SRT 逐字节相等。",
        "重冻 paddle_quality_baseline.v1.json 与受影响 benchmark baseline，记录 oracle_commit、合并层 commit、模型/ORT 指纹、新 hash 与阈值来源；旧基线归档保留。"
      ],
      "areas": [
        "scripts/parity",
        "benchmark/parity/goldens",
        "benchmark/datasets",
        "docs/TESTMAP.md"
      ],
      "status": "not-started",
      "evidence": []
    },
    {
      "id": "D03",
      "name": "覆盖矩阵、碎片合并与全门质量验证",
      "outcome": "在未参与调参的素材与全部产品路径上验证选定几何策略，并修复真实 720p 的相邻碎片化，形成可复核的质量和性能证据。",
      "acceptance": [
        "覆盖 bottom-crop、full-frame、ROI、竖屏、超宽条带与真实低分辨率源（非下采样合成），每类至少 1 个素材。",
        "paddle_quality 全门通过：CER macro/micro、exact、usable recall、timing F1/precision、noise/empty、split/FP 均记录且满足 D01/D02 冻结的阈值。",
        "实现 pipeline 内的相邻碎片合并：时间相邻（≤300ms）+ 较短文本是较长文本的子序列（长度比 ≥0.6）+ 保留较短的干净文本；在 Zootopia 720p 上 timing F1 ≥736、precision 差距 ≤1pp、CER/exact 不劣化；1080p 736 输出 hash 保持 56b1b08a…；有单元测试与回归样本。",
        "在真实 720p 与 22.5–25% 素材上复核 0.6 的左边界裁切与 timing；若 precision 仍低于 736 超过 1pp，再评估短边 320/352 条件项。",
        "用 Python/RapidOCR 在同一 crop、同一 736 参数下做 det box 级对照，复现框破碎，排除 C++ DB 后处理移植偏差；不得用受合并层影响的整段 SRT 代替。"
      ],
      "areas": [
        "benchmark/configs",
        "benchmark/datasets",
        "cpp/src/pipeline",
        "cpp/tests"
      ],
      "status": "not-started",
      "evidence": []
    },
    {
      "id": "D04",
      "name": "默认切换、回滚与收口",
      "outcome": "产品默认路径切换到选定几何策略，固定负载约 3 倍，质量门通过；一键回滚 736 可演练；文档与进度真源同步。",
      "acceptance": [
        "默认配置切换，无需 env 即可生效；默认路径输出与 D03 证据一致。",
        "固定负载 A/B 与质量门证据写入 D04 evidence；det 占比与端到端倍数可复核。",
        "回滚演练：恢复 736 后固定负载 SRT 回到 56b1b08a…，无需重新构建。",
        "progress.md/phases.json 同步；Phase 经 ready-for-merge 后在 main 复验并置 done。"
      ],
      "areas": [
        "cpp/src/adapters/paddle",
        "cpp/include",
        "docs",
        "phases.json",
        "progress.md"
      ],
      "status": "not-started",
      "evidence": []
    }
  ],
  "exit_criteria": [
    "ADR-0042 获批并写入 docs/DECISIONS.md。",
    "质量门在新基线上可执行并通过，旧基线可追溯。",
    "覆盖矩阵完成，未参与调参素材的平台复核通过。",
    "默认切换与一键回滚演练完成，回滚后输出恢复 56b1b08a…。",
    "./init.sh 与匹配的产品/离线验证通过，progress.md 与 phases.json 同步。"
  ]
}
