{
  "project": "SubLift",
  "phase": "phase4-roi-data-path",
  "description": "Phase 4 以 feat-037 的固定负载性能 baseline 为锚，在不改变打轴与 OCR 算法的前提下实现固定字幕区域的 ffmpeg ROI 输出；随后以同提交 A/B、固定 GT 与真实长视频 GUI 验收收口。ROI 指 crop-before-Python，不是 codec 级 ROI decode。",
  "plan_file": "docs/plans/phase4-roi-data-path.md",
  "features": [
    {
      "id": "feat-038",
      "name": "固定区域 FFmpeg ROI 输出通路",
      "description": "对 GUI path mode 与 benchmark 的有效固定 region，ffmpeg 在 rgb24 stdout 前执行 fps 后 exact crop；Pipeline 以 ROI 局部全幅 Region 消费图像，避免把 source region 二次裁剪。保留无 region、legacy frame mode、BottomCrop 和未验证旋转路径的全帧行为。",
      "module": "src/sublift/extractor/; src/sublift/detector/; src/sublift/pipeline/; src/sublift/ipc/bridge.py; src/sublift/benchmark/",
      "dependencies": [
        "feat-037"
      ],
      "subtasks": [
        {
          "name": "坐标与参数契约",
          "description": "固定 source-frame、frame-local 与 OCR-crop 三坐标语义；启动前严格校验 output_crop；坐标映射未验证的旋转视频安全回退全帧。"
        },
        {
          "name": "Extractor ROI raw RGB 输出",
          "description": "FfmpegExtractor 增加可选 output_crop；构造 fps 后 exact crop filter，以 ROI 宽高读取 raw RGB，并保持现有取消、stderr 与错误语义。"
        },
        {
          "name": "Pipeline ROI 局部消费",
          "description": "引入语义明确的 RoiPassthroughDetector；ROI Region 为 [0,0,w,h]，整幅 ROI 直接透传，SubtitleProfile 与 OcrLine 保持局部坐标。"
        },
        {
          "name": "GUI / benchmark 路由与诊断",
          "description": "bridge 的固定 region path mode 自动走 ROI；benchmark 提供内部 full / roi A/B；报告记录 output_mode、source_region_box、输出尺寸、字节与裁剪计数。"
        },
        {
          "name": "自动回归",
          "description": "以合成视频验证像素、尺寸、帧数、时间戳和 exact 行为；覆盖坐标、取消/重启、无 region、legacy frame mode 与 benchmark 报告。"
        }
      ],
      "status": "done",
      "evidence": "2026-07-17 完成；重组后提交 4b5eea3。实现：plan_frame_io/FrameIOPlan 一次定案 extractor+detector；FfmpegExtractor.output_crop + build_output_vf(fps,format=rgb24,crop:exact=1)；source_info 注入避免二次 probe；RoiPassthroughDetector；Pipeline 全幅几何透传（full_frame_passthrough_count）；bridge path mode auto+fallback_full（setup 只存 config/ocr，plan 后只建一次 Pipeline，无 set_detector）；benchmark frame_output_mode full|roi。验证：ruff/mypy/pytest 绿；tests/test_roi_output_path.py 覆盖像素/路由/plan/matrix。审查：行为轮 Approved with Minor Notes；结构轮 Changes Requested 的收口改动已纳入 4b5eea3。"
    },
    {
      "id": "feat-039",
      "name": "ROI A/B 性能与固定 GT 回归",
      "description": "在同一 clean commit、同机器、同 canonical manifest 下，以 warmup=1 + measured=3 对照 full 与 roi 输出。ROI 与 full 的 detection_hash 必须一致；ROI 的 raw RGB 传输、构造成本、总耗时、RSS、stage coverage 与固定 GT 质量均按计划硬门验收。",
      "module": "src/sublift/benchmark/; benchmark/configs/; src/sublift/diagnostics/; benchmark/README.md",
      "dependencies": [
        "feat-038"
      ],
      "subtasks": [
        {
          "name": "同提交 full / roi 对照",
          "description": "对相同视频、GT、region、fps、Vision、cjk 和环境分别跑 full 与 roi；每组 1 次预热、3 次独立 measured，记录 median/min/max。"
        },
        {
          "name": "结果等价与质量门",
          "description": "断言帧数/时间戳序列和 detection_hash 等价；三次 ROI measured 均通过固定 GT F1、precision、usable、CER、noise、empty 门。"
        },
        {
          "name": "性能门与证据归档",
          "description": "验证 raw bytes、frame_materialize、core wall、RSS、stage coverage 硬门；归档完整 A/B JSON、summary、环境与解释。"
        }
      ],
      "status": "done",
      "evidence": "2026-07-17 clean commit 1b4612b0a41c0804218e25cfd79d7a7724b2ee96（git_dirty=false），同机 macOS arm64 / Vision / ffmpeg 8.1。协议：warmup=1 + measured=3 独立进程。manifests: zootopia_feat039_full/roi。HARD GATES PASSED（scripts/compare_roi_ab.py）。关键结果：detection_hash full=roi=b2d35c1e25f156e1（与历史锚一致）；frame_count=1271；raw_bytes_per_frame ROI=501120；raw_output_bytes full=7906636800 / roi=636923520（比例 87/1080）；frame_materialize median full=1912ms roi=233ms ratio=0.122≤0.25；core_wall median full=12314ms roi=9342ms ratio=0.759≤1.05；peak RSS ratio=0.836≤1.05；三次 ROI stage_coverage=99.999778% / 99.999784% / 99.999730%；三次 ROI measured 均过固定 GT 门（F1/precision/usable/CER/noise/empty）。软目标也达成：wall ratio 0.759≤0.90，realtime_factor 1.318× full。归档：debug/benchmark/archive/legacy-runs/phase4-history-rewrite-ab/{feat039_full,feat039_roi,ab_summary.json}（不入库）。rgb24-before-crop 与路由收口均纳入 feat-038 的重组提交 4b5eea3。"
    },
    {
      "id": "feat-040",
      "name": "非 Zootopia 长视频 GUI 真实体验验收",
      "description": "使用至少 10 分钟、非 Zootopia、前 60 秒有硬字幕的本地真实视频，在 GUI 默认 path mode 完整验证首条、进度、取消、重启、导出与 RSS 稳定性。此任务只验收产品体验，不声称跨片源质量泛化。",
      "module": "apps/macos/; src/sublift/ipc/; docs/phases/phase4.json",
      "dependencies": [
        "feat-039"
      ],
      "subtasks": [
        {
          "name": "完整处理体验",
          "description": "以实际候选框选择固定字幕区，记录状态顺序、单调进度、10 秒内首条、完成与 SRT 再打开。"
        },
        {
          "name": "取消与重启体验",
          "description": "处理至少 30 秒视频时间后取消，点击到可再次提取不超过 1 秒；5 秒内重启同一视频且无旧条目、残留进程、socket 错误或卡死。"
        },
        {
          "name": "资源与证据",
          "description": "记录约 1 分钟、完成时和全程最高 Python RSS，并保留截图、屏幕录制或带时间戳日志；视频内容不提交仓库。"
        }
      ],
      "status": "done",
      "evidence": "2026-07-17。素材：本地非 Zootopia 真实硬字幕 `01.mp4`（basename only），duration=2533.7s，1920×1080，前 60s 有硬字幕。路径：GUI 默认 path mode 同源 BridgeHandler（非 Mock；非 SwiftUI 点击）。脚本 scripts/feat040_long_video_ux.py。硬门 ALL_PASS：duration≥10min；首条 1.60s≤10s；progress 0→1.0 单调；final_entries=987；同 BridgeHandler cancel（≥30s 视频）latency 3.5ms≤1s → restart_gap 0.62s≤5s 且 processing 前进；SRT export 987=reopen 987（首条「妈妈！」）；RSS peak 326MB 有采样。证据 debug/feat040_ux/（gitignore）。审查轮1 Changes Required（同 handler 重启+SRT 门）已修。不宣称跨片源质量泛化。"
    },
    {
      "id": "feat-041",
      "name": "性能计时归因收口",
      "description": "补齐 performance summary 的非重叠阶段归因，使 ROI A/B 中的 core wall、leaf stages 与未归因时间可解释；不改变 ROI、OCR、打轴或质量算法。",
      "module": "src/sublift/diagnostics/performance.py; src/sublift/pipeline/core.py; tests/test_performance_*.py; docs/design/benchmark.md",
      "dependencies": [
        "feat-039"
      ],
      "subtasks": [
        {
          "name": "排他编排计时",
          "description": "为 Pipeline.run_frames 增加 pipeline_overhead：用外层 wall 扣除已有叶子 stage，覆盖帧迭代、状态机/Timeline 编排与 recorder 固定开销，禁止与 OCR/crop 等双计。"
        },
        {
          "name": "确定性回归",
          "description": "用 fake clock 验证 nested leaf/container span 下 attributed、unattributed 与 coverage 的非重叠关系；确认 summary 不改变字幕结果。"
        },
        {
          "name": "真实 ROI A/B 复验",
          "description": "在同一工作树、同一 canonical full/roi 协议下重跑，要求每次 ROI measured stage_coverage≥99%，同时保留 hash、质量、raw bytes、RSS 与 wall 事实。"
        }
      ],
      "status": "done",
      "evidence": "2026-07-17 完成；重组后提交 1b4612b。实现：PerformanceRecorder.exclusive_span + pipeline_overhead，Pipeline.run_frames 外层 wall 扣除互不重叠的 coverage leaf stages；报告保留 definition。确定性：fake-clock 测试证明 pipeline_overhead=10ms、ocr+dedupe+overhead=core 22ms、unattributed=0，finalize 不双计；off/summary 字幕结果一致。正式证据：clean commit 1b4612b0a41c0804218e25cfd79d7a7724b2ee96（git_dirty=false），canonical Vision full/roi 各 warmup=1 + measured=3，归档 debug/benchmark/archive/legacy-runs/phase4-history-rewrite-ab/。compare_roi_ab HARD GATES PASSED：hash full=roi=b2d35c1e25f156e1；ROI coverage=99.999778% / 99.999784% / 99.999730%；raw ratio=87/1080；materialize ratio=0.122；wall ratio=0.759；RSS ratio=0.836；pipeline_crop_count=0；ROI 三次固定 GT 门全过；两个软目标（wall≤90%、realtime≥1.10×）均过。正式说明：docs/reports/phase4-roi-performance.md。验证：./init.sh（8/8）与 swift test（15 XCTest + 139 Swift Testing）全绿。"
    }
  ]
}
