{
  "schema_version": 2,
  "project": "SubLift",
  "phase": "Phase 17 - 产品表面收口（Contract 语义）",
  "goal": "在不新增用户功能的前提下，把 Web/macOS/CLI/Server 的能力语义收敛到 contracts/ 的单一合同层。完成后，同一输入在四个入口得到一致的配置语义、SRT 字节与输出冲突结果，parity matrix 明确 shared/host-specific/deferred/gap；Session/Layout/工具链收口拆到 Phase 19。",
  "scope": [
    "D01：建立 contracts/ 的 schema、fixtures 与 docs/design_ui/shared/parity.md，冻结 shared/host-specific/deferred/gap 四类差异；不改变产品行为。",
    "D02：统一 SRT 格式、输出重名策略、ROI 坐标转换、confidence/engine 默认值与 Job/Task 状态映射，并在 C++/Swift/TS 三套测试中消费同一批 fixture。"
  ],
  "non_goals": [
    "不新增用户可见功能，不改变产品交互或视觉设计；UI 像素级统一不在本 Phase 范围。",
    "不重写 Phase 1–12 历史、phase JSON evidence 或已归档负向证据；历史只做勘误与索引。",
    "不重新引入 Python 产品 runtime、Python IPC 或 .venv 驱动的 Worker 查找。",
    "不启动 Phase 16 的 P1/P2 性能优化、GPU/CUDA、ASS/VTT、账号系统或公网部署。",
    "Session/Layout/根目录收口拆出到 Phase 19；本 Phase 不搬目录、不重构 ApplicationSession。",
    "不把 macOS 与 Web 强行合并为同一套 UI 代码；共享的是合同与状态语义，不是像素。"
  ],
  "status": "done",
  "deliverables": [
    {
      "id": "D01",
      "name": "合同清单、Parity Matrix 与可执行 fixtures",
      "outcome": "contracts/ 成为跨语言 DTO 与语义的唯一定义处；parity matrix 明确哪些能力必须一致、哪些是宿主差异、哪些暂缓、哪些是已知缺口；fixtures 可被 C++/Swift/TS 测试直接消费。",
      "acceptance": [
        "contracts/README.md 说明 owner、版本策略、schema 与 fixture 的增删规则。",
        "contracts/schemas/ 覆盖 ExtractionSpec、JobState/JobEvent、OutputPlan/SaveResult。",
        "contracts/fixtures/ 覆盖 defaults、ROI 坐标、SRT 字节、输出冲突与状态迁移。",
        "scripts/verify-contracts.sh 能校验 fixtures 对 schema 与基本不变量，失败即非零退出。",
        "docs/design_ui/shared/parity.md 为每个能力标注 shared/host-specific/deferred/gap。",
        "本 Deliverable 不修改产品代码，不改变任何入口的运行时行为。"
      ],
      "areas": [
        "contracts",
        "docs/design_ui/shared",
        "scripts"
      ],
      "status": "done",
      "evidence": [
        "2026-10-20：contracts/ 初版落地（VERSION、5 schemas、defaults/extraction/ROI/SRT/output/job/status fixtures、check_contracts.py、verify-contracts.sh）与 docs/design_ui/shared/parity.md；verify-contracts.sh schema 与参考语义校验通过。",
        "2026-10-20：D01 收口。contracts 作为跨语言语义定义处，fixtures 采用纯 JSON，C++/Swift/TS 可直接读取；语言消费测试由 D02 接入，不在 D01 伪装已对齐。"
      ]
    },
    {
      "id": "D02",
      "name": "跨端语义对齐（SRT / 输出 / ROI / 默认值 / 状态）",
      "outcome": "同一批 SubtitleEntry 在 C++/Swift/TS 中生成相同 SRT 字节；同一冲突策略生成相同输出名；归一化 ROI 在各边界转换为相同像素 box；confidence/engine 默认值与 Job/Task 状态映射有单一合同。",
      "acceptance": [
        "SRT policy 固定排序、空文本、负数与 end<start 行为；C++/Swift/TS golden 字节一致。",
        "输出冲突策略 skip/deterministic_rename/replace 的重名规则冻结为 name_N.srt，并在 Server、Swift、Web 的 fixture 测试中一致。",
        "ROI 在 HTTP/UI 边界使用归一化 box，在 Worker 边界使用像素 box；转换、clamp 与 probe 失败语义有 fixture 与测试。",
        "confidence 默认值、engine capability 选择与 script 默认值在 CLI/Server/Web/Swift 中显式且一致，禁止隐式回退。",
        "JobStatus/TaskStatus 的映射表冻结；Web/Swift 不再各自发明阶段名。"
      ],
      "areas": [
        "cpp/src/core",
        "cpp/src/server",
        "cpp/src/application",
        "apps/web/src",
        "apps/macos/Sources/SubLiftMac/Core",
        "contracts/fixtures"
      ],
      "status": "done",
      "evidence": [
        "2026-10-20：D02 启动。先以 contracts 的 SRT/输出/默认值 fixtures 对齐三端，并逐项消除 parity matrix 中的 gap；不一次性改状态机与前端结构。",
        "2026-10-20：SRT 合同对齐。Web formatSrt 改为跳过纯空白并保持 canonical 钳制；Swift SrtFormatter 改为排序/跳空/钳制且不再抛 SrtFormatError；C++ CLI 与 Server formatter 增加排序、clamp 与末尾空行（两个换行，兼容容器 golden 的精确比对）。三端均消费 contracts/fixtures/srt-cases.json：Web 4 例、Swift 1 套共享 fixture、C++ CLI/Server 各 3 例通过。",
        "2026-10-20：输出重名对齐。Swift BatchOutputPlanner 从 name (N).srt 改为 name_N.srt，BatchOutputTests/Phase8AcceptanceTests 同步；Server/Web 已使用 _1。Web 157 tests、Swift 381 XCTest + 142 Swift Testing、C++ [srt] 33 assertions 与 ctest 261/261 全部通过。",
        "2026-10-20：Phase8 真实 IPC 验收的 SRT 断言改为“空或包含时间码”。spike 素材可能没有字幕；canonical 跳空后空 SRT 是合法结果，原断言依赖空文本条目生成非空文件。",
        "2026-10-22：confidence 请求默认值对齐 contracts/fixtures/defaults.json（0.0）：C++ CLI args/help、macOS 单视频与批量从 0.5 改为 0.0；Server/Web/protocol 已是 0.0；内部 Pipeline Config 保持 0.5 以兼容冻结 Python Oracle。C++ ctest 268/268、Swift 142 tests、Web 157 tests + build 通过。",
        "2026-10-22：ROI 转换对齐 contracts/fixtures/roi-cases.json。抽出 RegionBox::to_pixel_box（round → clamp origin → clamp w/h、最小 1），Server 使用；新增 [roi] 测试消费 5 个 fixture 用例并覆盖空帧 fail-closed；ROI probe 失败不再静默回退，改由 Job 外层 catch 标记 Failed。ctest 270/270。",
        "2026-10-22：Job/Task 状态映射对齐 contracts/fixtures/statuses.json。C++ JobStatus 扩展为 queued/preparing/extracting/finalizing/completed/failed/cancelled/interrupted，由 Worker progress stage 迁移；legacy \"running\" 读入映射为 extracting；新增 [statuses] 测试消费 fixture 的 job/task/mapping；Web BATCH_TASK_STATUSES 与 Swift BatchTaskStatus 增加 fixture 消费测试。C++ ctest 272/272、Web 159 tests + build、Swift 143 tests 通过。",
        "2026-10-22：engine/script 默认值对齐 defaults.json。Server JobConfig.engine 从 paddle 改为 vision（engine_preference[0]），不可用引擎仍由路由 400 fail-closed；新增 [defaults] 测试消费 defaults.json，断言 CLI/Server 的 engine/script/confidence 默认值与内部 Config 的 script；新增 [server][jobs] ROI probe 失败用例，确认 Job 置 Failed 而非静默丢弃 region。ctest 273/273。"
      ]
    }
  ],
  "exit_criteria": [
    "D02 的 contracts fixtures 被 C++/Swift/TS 三套测试消费；同一输入在四个入口产生相同 SRT 字节与输出冲突结果。",
    "不改变用户可见功能与产品运行时语义；所有行为变更都由合同测试与现有产品门锁定。"
  ]
}
