{
  "project": "SubLift",
  "phase": "phase4.1-post-roi-throughput",
  "description": "Phase 4.1 曾以已完成的 ROI 数据通路为基础，实验性验证 GUI 默认 path mode 的有界生产者—消费者重叠。结果、质量、队列与取消均正确，但两轮真实 Vision A/B 未达到吞吐最低门；实验代码未保留在 main，产品继续使用串行 path mode。本 Phase 归档为负向性能证据，不再继续调优。",
  "plan_file": "docs/plans/phase4.1-post-roi-throughput.md",
  "features": [
    {
      "id": "feat-042",
      "name": "有界 path-mode 抽帧—Pipeline 重叠",
      "description": "为 GUI 默认 Python path mode 引入 job-local PathJobSession、容量固定的帧 FIFO 和单消费者 Pipeline。ffmpeg producer 与串行 Pipeline/OCR consumer 可重叠运行；进度按已消费帧计，取消、错误和重启以 session 生命周期隔离。性能记录改为 producer / consumer / end-to-end 三条可解释 lane，禁止把重叠耗时相加成 coverage。",
      "module": "src/sublift/ipc/bridge.py; src/sublift/extractor/ffmpeg_extractor.py; src/sublift/diagnostics/performance.py; scripts/; tests/; apps/macos/",
      "dependencies": [
        "feat-041"
      ],
      "subtasks": [
        {
          "name": "Job-local 生命周期与所有权",
          "description": "定义 PathJobSession；producer 独占 FfmpegExtractor/generator，consumer 独占 Pipeline/Vision OCR，外层只持有当前 session 的取消句柄，避免 handler 级共享字段在取消后立即重启时串任务。"
        },
        {
          "name": "有界 FIFO 与正常结束",
          "description": "以 Queue(maxsize=8) 连接 producer 和 consumer；队列满时短超时等待并检查取消事件，EOF/error 用明确哨兵传递，consumer 仅在消费 EOF 后 finalize。"
        },
        {
          "name": "进度、取消与重启协议",
          "description": "进度以已消费帧数为准；覆盖 ffmpeg read、满队列等待和 OCR 阻塞三种取消点；旧 session 完全退出且不再推送条目后才允许其完成消息影响 UI。"
        },
        {
          "name": "并发性能口径",
          "description": "为 end-to-end、producer 与 consumer 建立线程安全且不可相加的计时/队列指标；报告 queue high-watermark、backpressure wait、RSS 和质量结果，避免沿用串行 exclusive_span 的全局差分语义。"
        },
        {
          "name": "回归、真实 path-mode 与 clean-commit A/B",
          "description": "补齐确定性并发、取消/重启、ROI/full fallback、真实 ffmpeg path-mode 和性能报告测试；以同机 clean commit 的 warmup=1 + measured=3 比较串行基线与重叠实现。"
        }
      ],
      "status": "archived",
      "evidence": "2026-07-23 实验候选冻结于 c39cc3ca761bd97bc556f31d00859b9220835720；未合入 main。真实 Vision、canonical Zootopia 1080p ROI、5fps、cjk、每组 warmup=1 + measured=3：两次独立 A/B 的 serial/overlap detection_hash 均为 b2d35c1e25f156e1，固定 GT 质量全过、queue_high_watermark≤8；但 end_to_end wall median 比分别为 0.9559（8121/8496ms，未达≤0.95）和 1.0587（9050/8549ms，回退），第二次首条比 1.077 亦未达≤1.05。取消早期 98ms、重启约2.03s；中途取消点接近任务结束，不能单独证明 Vision in-flight 后零消息。结论：producer/consumer 机制正确但 ROI 后单消费者 Vision 主导，未验证用户可见吞吐收益；回退到 a59e555 的串行路径。原始忽略产物：debug/feat042/ab/、ab_clean/、cancel/、converge/。"
    }
  ]
}
