{
  "project": "SubLift",
  "phase": "phase4.2-ocr-performance-attribution",
  "description": "Phase 4.2 在保持串行 path mode、ROI、打轴和 OCR 行为不变的前提下，为 Vision OCR 建立内部可解释计时、逐段决策 trace 与 canonical 基线。其交付是可信的下一步优化决策，不是预设的速度优化。",
  "plan_file": "docs/plans/phase4.2-ocr-performance-attribution.md",
  "features": [
    {
      "id": "feat-043",
      "name": "Vision OCR 内部归因与决策基线",
      "description": "将既有 `ocr` coverage leaf 细分为不参与 coverage 相加的内部树：输入准备/CGImage、request 设置、Vision perform、observation 映射与 residual；trace 同时记录代表帧、匿名调用尺寸、早停原因、行选择/共识成本及接受结果。以 canonical Vision 的 summary/trace 和固定 GT 建立报告，再由数据选择唯一下一项优化方向。",
      "module": "src/sublift/diagnostics/performance.py; src/sublift/ocr/vision.py; src/sublift/pipeline/core.py; benchmark/; tests/; docs/",
      "dependencies": [
        "feat-041"
      ],
      "subtasks": [
        {
          "name": "有界归因模型与对账",
          "description": "定义 OCR parent/child/residual、summary 和 trace schema；保证内部项不进入 core coverage，且 samples、geometry buckets 和逐段调用明细均有硬上限。"
        },
        {
          "name": "Vision 可选 observer",
          "description": "在不改 OcrEngine Protocol 的前提下，为 Vision 接入输入准备、request 设置、perform 与 observation mapping 计时；空/失败调用也可对账，非 Vision 以 opaque fallback 降级。"
        },
        {
          "name": "段内决策 trace",
          "description": "记录匿名调用尺寸、早停原因、行选择/cleanup/consensus 成本和接受结果；`representative_selection_ms` 为历史字段名，当前表示包容性段决策 wall；禁止落盘文字、图像、OCR box 或绝对路径。"
        },
        {
          "name": "真实基线与优化分流报告",
          "description": "按 canonical clean-commit 协议运行 off/summary/trace；验证 hash、GT 质量、对账与隐私，并在正式报告中给出唯一下一 feature 建议。summary 扰动失败须限制报告用途，不伪称已证明根因。"
        }
      ],
      "status": "completed",
      "evidence": "验证提交 abafab2（git_dirty=false）。自动验证：453 tests / ruff / mypy / init.sh 8/8。\n\n正式报告：docs/reports/phase4.2-ocr-attribution-baseline.md\n原始产物：debug/benchmark/archive/legacy-perf/phase4.2_ocr_attribution/{phase42_off,phase42_summary,phase42_trace}/\n\n命令（2026-07-24）：\nuv run --extra vision python scripts/run_benchmark_manifest.py debug/benchmark/archive/legacy-perf/phase4.2_ocr_attribution/manifest_{off,summary,trace}.json --label manifest\n协议：Zootopia 1080p ROI [0,848,1920,87] 5fps Vision cjk warmup=1 measured=3\n\n完成门：\n- hash 一致 PASS b2d35c1e25f156e1（off/summary/trace 全部 measured）\n- GT 质量 PASS：F1 97.67% precision 98.82% usable 91.95% CER 3.20% noise 0 empty 0\n- summary/trace 调用数对账 PASS：各 measured run 均为 110；off 不输出调用数，以 hash/GT 等价验证产品结果\n- 内部 coverage ≈100% PASS；parent↔outer 差 ~10ms PASS\n- 隐私 PASS（trace JSONL 无文本/路径）\n- trace 扰动 PASS 1.026（门 ≤1.10）\n\n限制（非阻断）：\n- summary 扰动 FAIL 1.319（门 ≤1.05）；根因未由本轮分块三次测量证明。summary 不可作产品速度基线；trace/off=1.026 仅排除“trace 必然更慢”的简单解释\n- historical 字段 `representative_selection_ms` 是完整段内 OCR 决策的包容性 wall，不作为纯代表帧收集成本解释\n\n关键读数（summary median）：\n- core_wall 13319 ms；ocr 5735 ms（43% core）\n- vision_perform ≈99% OCR parent；prepare+setup ≈1%；mapping/residual <0.3%\n- 段决策：92 accepted；76 段单次 OCR、15 段双帧共识、1 段四次调用后成功；OCR 调用 110 / 代表候选 360\n\n收口决定：归因、结果等价、质量、对账与隐私均完成，feat-043 标记 completed。summary 扰动失败作为性能模式限制永久保留；若未来需要它作产品速度承诺，另做交错 off/summary 配对复测。\n\n下一优化方向：先扩充英文、中英混排、不同字幕位置和不同片源 GT；随后在所有来源质量门内实验代表帧排序与有效 OCR 调用数，优先减少空 retry。不得直接降低共识阈值或默认改动；不建议桥接、并行、输入几何默认改动或 producer/consumer 重叠。\n"
    }
  ]
}
